{
  "metadata": {
    "schema_version": "0.1",
    "matchup": "PvP",
    "generated_at": "2026-05-08T00:00:00Z",
    "generator": "manual",
    "source_replays": 0,
    "notes": "Initial reference playbook — standard 2-gate Stalker opening into Robo. Used to validate the schema; not yet tuned."
  },

  "build_order": [
    { "trigger": { "supply": 14 }, "action": { "kind": "produce",  "target": "Pylon" } },
    { "trigger": { "supply": 16 }, "action": { "kind": "produce",  "target": "Gateway" } },
    { "trigger": { "supply": 17 }, "action": { "kind": "produce",  "target": "Assimilator" } },
    { "trigger": { "supply": 19 }, "action": { "kind": "produce",  "target": "Assimilator" } },
    { "trigger": { "supply": 20 }, "action": { "kind": "produce",  "target": "CyberneticsCore" } },
    { "trigger": { "supply": 22 }, "action": { "kind": "produce",  "target": "Pylon" } },
    { "trigger": { "on": "cybernetics_core_complete" }, "action": { "kind": "research", "target": "WarpGate" }, "chrono": true },
    { "trigger": { "supply": 24 }, "action": { "kind": "produce",  "target": "Stalker" }, "chrono": true },
    { "trigger": { "supply": 27 }, "action": { "kind": "produce",  "target": "Gateway" } },
    { "trigger": { "supply": 30 }, "action": { "kind": "expand",   "target": "Nexus" } },
    { "trigger": { "supply": 34 }, "action": { "kind": "produce",  "target": "RoboticsFacility" } },
    { "trigger": { "on": "robotics_facility_complete" }, "action": { "kind": "produce", "target": "Observer" } },
    { "trigger": { "supply": 42 }, "action": { "kind": "produce",  "target": "Immortal" }, "chrono": true, "skip_if": "proxy_gate" }
  ],

  "composition_targets": {
    "early": { "Stalker": 0.8, "Zealot": 0.2 },
    "mid":   { "Stalker": 0.5, "Immortal": 0.3, "Observer": 0.1, "Sentry": 0.1 },
    "late":  { "Stalker": 0.3, "Immortal": 0.3, "Colossus": 0.2, "Observer": 0.1, "HighTemplar": 0.1 }
  },

  "macro_rules": {
    "probe_cap": 60,
    "gas_workers_per_geyser": 3,
    "supply_buffer_pct": 0.15,
    "expand_at_supply": 30,
    "max_bases": 3
  },

  "reactions": [
    { "trigger": "proxy_gate",  "response": "early_shield_battery", "priority": 2, "notes": "Drop Robo, prioritize Stalkers + battery at nexus." },
    { "trigger": "dt_rush",     "response": "rush_observer",        "priority": 2 },
    { "trigger": "oracle_harass","response": "build_stargate_phoenix","priority": 1 }
  ]
}
